<?xml version="1.0" encoding="UTF-8"?>
<schema xmlns="http://www.w3.org/2001/XMLSchema"
        targetNamespace="http://www.example.org/unitSystem"
        xmlns:tns="http://www.example.org/unitSystem"
        elementFormDefault="qualified">

    <element name="xml">
        <complexType>
            <sequence>
                <element name="unitSystem" type="tns:unitSystem" maxOccurs="unbounded"/>
            </sequence>
        </complexType>
    </element>

    <complexType name="unitSystem">
        <sequence>
            <element name="name" type="tns:name"/>
        </sequence>
        <attribute name="ref" type="tns:refType" use="required"/>
    </complexType>

    <simpleType name="refType">
        <restriction base="string">
            <pattern value="([a-z0-9_-])*"/>
        </restriction>
    </simpleType>

    <complexType name="name">
        <sequence>
            <element name="fr" type="string"/>
            <element name="en" type="string"/>
        </sequence>
    </complexType>
</schema>